{
  "backend": "rsinter",
  "execution_status": "real",
  "id": "rbposd-bb72-osd1-v1",
  "impl_key": "rbposd",
  "language": "rust",
  "parameters": {
    "bp_algorithm": "min_sum",
    "bp_iters": 50,
    "early_stop": true,
    "osd_method": "combination_sweep",
    "osd_order": 1
  },
  "title": "BB72 BP+OSD OSD1 via rsinter"
}
